Schedule,Paragraph,Description,H-S Extra,Specific_HS,Units_HS,Ad_Valorem_HS,Extra,Specific_Geneva,Units_Geneva,Ad_Valorem_Geneva,Specific_Annecy,Units_Annecy,Ad_Valorem_Annecy,Specific_Torquay,Units_Torquay,Ad_Valorem_Torquay
10,1018,"Bags or sacks made from plain-woven fabrics of single jute yarns or from twilled or other fabric wholly of jute: Bleached, colored, dyed, painted, printed, stenciled, or rendered noninflammable",,,,,,0.5,1,5,,,,0.5,1,7.5
10,,Other,,,,,,0.5,1,7.5,,,,0.5,1,5
10,1019,"Bagging for cotton, gunny cloth, and similar fabrics, suitable for covering cotton, composed of single yarns made of jute, jute butts, or other vegetable fiber, not bleached, colored, dyed, painted, printed, or stained, not over 16 threads to the square inch, counting the warp and filling, and weighing per square yard: 15 or more but not over 32 ounces",,,,,,0.6,44,,,,,0.6,44,
10,,Over 32 ounces,,,,,,0.3,1,,,,,0.3,1,
10,1020,Floor oilcloth and mats and rugs made thereof,,,,,,,,10,,,,,,10
10,,Linoleum and mats and rugs made thereof: In laid,,,,,,,,25,,,,,,25
10,,"Other, including cork carpet and corticine",,,,,,,,15,,,,,,15
10,1021,"Carpets, carpeting, mats, matting, and rugs, wholly or in chief value of flax, hemp, or jute, or a mixture thereof",,,,,,1.5,44,,,,,,,17.5
10,,Floor coverings nspf: Felt-base,,,,,,,,12.5,,,,,,12.5
10,,Other (except grass and rice straw),,,,,,,,20,,,,,,20
10,1022,"Matting and articles made therefrom, wholly or in chief value of cocoa fiber or rattan",,,,,,5,44,,,,,5,44,
10,,Pile mats and floor coverings: Wholly or in chief value of cocoa fiber,,,,,,10,44,,,,,10,44,
10,,Wholly or in chief value of rattan,,,,,,4,44,,,,,4,44,
10,1023,"Manufactures wholly or in chief value of vegetable fiber (except cotton), nspf",,,,,,,,20,,,20,,,20
11,1101.a,"Aleppo, Arabian, Bagdad, Black Spanish, Chinese, Cordova, Cyprus, Donskoi, East Indian, Ecuadorean, Egyptian, Georgian, Haslock, Iceland, Kerry, Manchurian, Mongolian, Oporto, Persian, Pyrenean, Sardinian, Scotch Blackface, Sistan, Smyrna, Sudan, Syrian, Thibet­an, Turkestan, Valparaiso, and Welsh Mountain wools; similar wools without merino or English blood; and other wools of whatever blood or origin not finer than 40s; all the foregoing: In the grease or washed",,,,,of clean content,13,1,,,,,13,1,
11,,On the skin,,,,,of clean content ,11,1,,,,,11,1,
11,,Scoured,,,,,of clean content ,16,1,,,,,16,1,
11,,"Sorted, or matchings, if not scoured",,,,,of clean content ,14,1,,,,,14,1,
11,1101.b,"Any of the foregoing wools entered, or withdrawn from warehouse, under bond and used only in the manufacture of press cloth, knit or felt fulled lumbermen's socks, carpets, luges, or other floor coverings",,,,,"Free, subjects too the provisions of paragraph 1101(b), Tariff At of 1930, as amended",,,0,,,,,,
11,1102.a,"Wools nspf, not finer than 44s: In the grease or washed",,,,,of clean content ,17,1,,,,,17,1,
11,,On the skin,,,,,of clean content ,15,1,,,,,15,1,
11,,Scoured,,,,,of clean content ,20,1,,,,,20,1,
11,,"Sorted, or matchings, if not scoured",,,,,of clean content,18,1,,,,,18,1,
11,1102.b,Wools nspf: In the grease or washed,,,,,of clean content,25.5,1,,,,,25.5,1,
11,,On the skin,,,,,of clean content ,24,1,,,,,24,1,
11,,Scoured,,,,,of clean content ,27.75,1,,,,,27.75,1,
,,,,,,,"Notes: In the event that the rate of 25.5 cents per pound of clean content specified in this item for wools, nspf in the grease pr washed, is superseded by different rate of duty provided for in items 1106,1107, 1108, 1109(a), 1109(b), 1110, 1111, 1112, 1113,1114(a), 1114(b),1114(c), 1114(d), 1115(a), and 1119 this part, insofar as it applies to articles wholly or in chief value of wool of sheep, shall be modiefied to an amount (calculated to the nearest cent per pound) having the same ratio to the rate stated in this part as the ratio of such superseding rate to the said 25.5 cent rate. All such modified rate thus calculated shall be effective on and after the day the superseding rate becomes applicable in lieu of the rate of 25.5 cents per pound of clean content prescribed in this item, and shall remain in effect there after with respect to produce provieded for in the items specified above so long as such superseding rate is applicable to wools, nspf in the grease or washed.",,,,,,,,,
11,,"Sorted, or matchings, if not scoured",,,,,of clean content ,26.25,1,,,,,26.25,1,
11,1102.b,"Hair of the alpaca, llama, and vicuna: In the grease or washed",,,,,of clean content ,,,,,,,9,1,
11,,On the skin,,,,,of clean content ,,,,,,,8,1,
11,,Scoured,,,,,of clean content ,,,,,,,10.5,1,
11,,"Sorted, or matchings, if not scoured",,,,,of clean content,,,,,,,9.5,1,
11,1102.b,"Hair of animals like the alpaca, Angora goat, or Cashmere goat (including hair of the Angora rabbit, but not including hair of the alpaca, Angora goat, Cashmere goat, llama, or vicuna): In the grease or washed",,,,,of clean content ,34,1,,,,,34,1,
11,,On the skin,,,,,of clean content ,32,1,,,,,32,1,
11,,Scoured,,,,,of clean content ,37,1,,,,,37,1,
11,,"Sorted, or matchings, if not scoured",,,,,of clean content,35,1,,,,,35,1,
11,,Hair of the Angora goat: In the grease or washed,,,,,of clean content,22,1,,,,,22,1,
11,,0n the skin,,,,,of clean content ,20,1,,,,,20,1,
11,,Scoured,,,,,of clean content ,25,1,,,,,25,1,
11,,"Sorted, or matchings, if not scoured",,,,,of clean content,23,1,,,,,23,1,
11,1105.a.b,Wool and hair wastes: Burr or card waste: Carbonized,,,,,,14.5,1,,,,,14.5,1,
11,,Not carbonized,,,,,,10.5,1,,,,,9,1,
11,,Flocks,,,,,,3.5,1,,,,,3.5,1,
11,,Garnetted waste,,,,,,14.5,1,,,,,12.5,1,
11,,Mungo and wool rags,,,,,,9,1,,,,,9,1,
11,,Noils: Carbonized,,,,,,17,1,,,,,16,1,
11,,Not carbonized,,,,,,12,1,,,,,12,1,
11,,"Ring waste, roving waste, slubbing waste, and top waste",,,,,,28,1,,,,,28,1,
11,,Shoddy and wool extract,,,,,,14,1,,,,,14,1,
11,,Thread or yarn waste,,,,,,11.5,1,,,,,10,1,
11,,Wool wastes nspf,,,,,,10.5,1,,,,,9,1,
11,1106,"Wool and hair of the kinds provided for in schedule 11, Tariff Act of 1930, if carbonized or advanced in any manner beyond the washed or scoured condi­tion, including tops, but not further advanced than roving",,,,,Geneva: if NOT Carbonized only --- 27.75 cents per lb and 12.5% ad val,27.75,1,6.25,,,,27.75,1,6.25
11,1107,Yarn wholly or in chief value of wool: Wholly or in chief value of Angora and rabbit hair,,,,,,40,1,15,,,,40,1,15
11,,Other,,,,,,30,1,20,,,,30,1,15
11,1108,"Woven fabrics weighing not over 4 ounces per square yard, wholly or in chief value of wool: With warp wholly of cotton or other vegetable fiber",,,,,,30,1,25,,,,30,1,25
11,,Other,,,,,,37.5,1,25,,,,37.5,1,25
11,1109.a,"Woven fabrics, weighing over 4 ounces per square yard, wholly or in chief value of wool: Green billiard cloths in the piece, weighing over 11 but not over 15 ounces per square yard, wholly of wool",,,,,,37.5,1,25,,,,37.5,1,20
11,,Other,,,,,,,,,,,,37.5,1,25
11,1109.b,"Belts, blankets, felts, jackets, or other articles of machine clothing, for paper-making, printing, or other machines, wholly or in chief value of wool, woven as units or in the piece, finished or unfinished",,,,,,37.5,1,20,,,,37.5,1,15
11,1110,"Pile fabrics wholly or in chief value of wool, whether or not the pile covers the entire surface, and all finished or unfinished articles made or cut from such fabrics; all the foregoing, whether the pile is wholly cut, wholly uncut, or partly cut",,,,,,33,1,25,,,,33,1,25
11,1111,"Blankets and similar articles (including automobile and carriage robes and steamer rugs), made as units or in the piece, finished or unfinished, wholly or in chief value of wool, not over 3 yards long",,,,,,30,1,30,,,,30,1,30
11,1112,"Felts, not woven, wholly or in chief value of wool, valued per pound: Not over $1.50",,,,,,22.5,1,20,,,,22.5,1,20
11,,Over $1.50,,,,,,30,1,20,,,,30,1,20
11,1113,"Fabrics with fast edges, not over 12 inches wide, and articles made there­from; braces, cords, cords and tassels, garters, suspenders, and tub­ings; all the foregoing, wholly or in chief value of wool",,,,,,37.5,1,20,,,,37.5,1,20
11,1114.a,"Knit fabric in the piece, wholly or in chief value of wool, valued per pound: Not over $1",,,,,,25,1,20,,,,25,1,20
11,,Over $1,,,,,,37.5,1,20,,,,37.5,1,20
11,1114.b,"Gloves and mittens, finished or unfinished, wholly or in chief value of wool, valued per dozen pairs: Over $1.75 but not over $4",,,,,,37.5,1,50,,,,37.5,1,50
11,,Over $4,,,,,,37.5,1,25,,,,37.5,1,25
11,1114.b,"Hose and half-hose, finished or unfinished, wholly or in chief value of wool, valued per dozen pairs: Not over $1.75",,,,,,30,1,20,,,,30,1,20
11,,Over $1.75,,,,,,37.5,1,20,,,,37.5,1,20
11,1114.c,"Knit underwear, finished or unfinished, wholly or in chief value of wool, valued per pound: Not over $1.75",,,,,,30,1,20,,,,3O,1,20
11,,Over $1.75,,,,,,37.5,1,20,,,,37.5,1,20
11,1114.d,"Articles knit or crocheted, finished or unfinished, wholly or in chief value of wool, and nspf, valued per pound: Not over $2: Berets, bonnets, caps, hats, and similar articles",,,,,,33,1,22.5,,,,33,1,22.5
11,,Other,,,,,,33,1,45,,,,33,1,45
11,,Over $2: Infants' outerwear: Made or cut from Jersey fabric knit in plain stitch on a circular machine,,,,,,37.5,1,25,,,,37.5,1,25
11,,Other,,,,,,37.5,1,37.25,,,,37.5,1,37.5
11,,"Berets, bonnets, caps, hats, and similar articles (not including any of the foregoing for infants)­",,,,,,37.5,1,25,,,,37.5,1,25
11,,"Other, valued per pound: Over $2 but not over $5",,,,,,37.5,1,30,,,,37.5,1,30
11,,Over $5,,,,,,37.5,1,20,,,,37.5,1,20
11,1115.a,"Articles of wearing apparel of every description, not knit or crocheted, manufactured wholly or in part, wholly or in chief value of wool, valued per pound: Not over $4",,,,,,25,1,25,,,,25,1,25
11,,Over $4,,,,,,37.5,1,25,,,,37.5,1,25
11,1115.b,"Bodies, forms, hoods, and shapes, for berets, bonnets, caps, hats, and similar articles, wholly or in chief value of wool but not crocheted or knit nor made in chief value of crocheted, knit, or woven material: Blocked or trimmed (including fin­ished articles), valued per dozen: Not over $12",,,,,and 8 cents per article,30,1,40,,,,3,1,40
11,,Over $12,,,,,and 8 cents per article,30,1,30,,,,30,1,30
11,,"Other, not pulled or stamped, valued over 50 cents per pound",,,,,,,,,25,1,55,25,1,55
11,1116.a,"Aubusson, Axminster, oriental, Savon­nerie, and other carpets, mats, and rugs, not made on a power-driven loom, figured or plain, whether woven as separate carpets, mats, or rugs, or in rolls of any width: Wholly or in chief value of hair of the alpaca, guanaco, huarizo, llama, misti, suri, or a combination of the hair of two or more of these species, valued per square foot: Not over $1.11-1/9",,,,,Geneva: but not less than 22.5 % ad val,15,6,,,,,12.5,6,
11,,Over $1.11-1/9,,,,,,,,,,,,,,11.25
11,,"Other, valued per square foot: Not over 66-2/3 cents",,,,,,,,,,,,15,6,
11,,Over 66-2/3 cents,,,,,,,,,,,,,,22.5
11,1116.b,"Carpets, mats, and rugs, figured or plain, whether woven as separate carpets, mats, or rugs, or in rolls of any width: Chenille Axminster",,,,,,,,30,,,,,,30
11,,"Of oriental weave or weaves, made on a power-driven loom",,,,,,,,,,,,,,25
11,1117.a,"Axminster, Brussels, velvet or tapestry, and Wilton carpets, mats, and rugs; and carpets, mats, and rugs of like character or description; all the foregoing",,,,,,,,30,,,,,,25
11,1117.c,"Floor coverings (including druggets and mats) wholly or in chief value of wool, nspf: Wholly or in chief value of hair of the Angora goat",,,,,,,,25,,,,,,25
11,,"Wholly or in chief value of hair of the alpaca, guanaco, huarizo, llama, misti, suri, or a combina­tion of the hair of two or more of these species, valued per square foot: Not over 40 cents",,,,,,,,,,,,,,15
11,,Over 40 cents,,,,,,,,,,,,,,30
11,,"Other, valued per square foot: Not over 40 cents",,,,,,,,15,,,,,,15
11,,Over 40 cents,,,,,,,,40,,,,,,40
11,1118,"Hassocks, screens, and other articles, wholly or in part of carpets, mats, or rugs, and nspf",,,,,,,,15,,,,,,15
11,1119,"Tapestries and upholstery goods (not including pile fabrics) in the piece or otherwise, wholly or in chief value of wool, and weighing per square yard: Not over 4 ounces",,,,,Geneva: no further classifications,37.5,1,25,,,,37.5,1,25
11,,"Over 4 ounces, valued per pound: Not over $2",,,,,,,,,,,,37.5,1,22.5
11,,Over $2,,,,,,,,,,,,37.5,1,17.5
11,1120,"Manufactures wholly or in chief value of wool, nspf: Cloth samples not over 104 square inches in area",,,,,,,,12.5,,,,,,12.5
11,,Other,,,,,,,,40,,,,,,40
12,1202,"Silk roving, and yarn of schappe silk, of spun silk, or of silk and rayon or other synthetic textile: Bleached, colored, dyed, or plied",,,,,,,,,,,,,,30
12,,Other,,,,,,,,,,,,,,25
12,1203,"Thrown silk not more advanced than organzine, singles, or tram",,,,,,,,,,,,,,10
12,1204,"Floss, sewing silk, silk threads or yarns of any description, and twist, made from raw silk, nspf",,,,,,,,,,,,,,20
12,1205,"Woven fabrics in the piece, wholly or in chief value of silk, over 30 inches wide and nspf, or not over 30 inches wide, whether woven with fast or split edges, including umbrella silk or Gloria cloth: With fibers wholly of silk: Bleached, colored, dyed, or printed, and valued over $5.00 per pound (except fabrics chiefly used for sten­cilling purposes in screen­process printing)",,,,,,,,25,,,,,,25
12,,"Not bleached, colored, dyed, or printed, if Jacquard-figured",,,,,,,,,,,32.5,,,32.5
12,,"With fibers chiefly but not wholly of silk: Bleached, colored, dyed, or printed: Jacquard-figured",,,,,,,,35,,,32.5,,,32.5
12,,"Not Jacquard-figured, in width: Over 30 inches",,,,,,,,30,,,,,,27.5
12,,"Not over 30 inches, valued per pound: Over $5",,,,,,,,,,,,,,27.5
12,,Not over $5,,,,,,,,,,,25,,,25
12,,"Not bleached, colored, dyed, or printed, if Jacquard-figured",,,,,,,,,,,32.5,,,32.5
12,1206.1.2.3,"Pile fabrics (including pile ribbons), whether or not the pile covers the en­tire surface, wholly or in chief value of silk, and all finished or unfin­ished articles made or cut from such fabrics; all the foregoing, whether the pile is wholly cut, wholly uncut, or partly cut",,,,,,,,25,,,,,,25
12,1207,"Braces, garters, and suspenders, wholly or in chief value of silk or of silk and india rubber, and nspf, whether or not Jacquard-figured",,,,,,,,20,,,,,,17.5
12,,"Fabrics with fast edges, not over 12 inches wide, and articles made there­from; cords, cords and tassels, tassels, and tubings; all the foregoing wholly or in chief value of silk or of silk and india rubber, and nspf, whether or not Jacquard-figured",,,,,,,,25,,,,,,22.5
12,1208,"Fabric in the piece, knit, wholly or in chief value of silk",,,,,,,,30,,,,,,27.5
12,,"Hose, half-hose, outerwear, underwear, and other articles, crocheted or knit, finished or unfinished, wholly or in chief value of silk: Gloves and mittens, valued per dozen pairs: Under $2.50",,,,,"Geneva: gloves and mittens, knit or crocheted: but not less than 30% nor more than 60% ad val",1.5,45,30,,,,,,60
12,,$2.50 or more but not over $5,,,,,,,,,,,,1.5,45,
12,,Over $5,,,,,,,,,,,,,,30
12,,Other,,,,,,,,,,,,,,30
12,1209,"Handkerchiefs and woven mufflers, wholly or in chief value of silk, finished or unfinished, valued over $5 per dozen: Not hemmed",,,,,,,,25,,,,,,25
12,,Hemmed or hemstitched,,,,,,,,27.5,,,,,,27.5
12,1210,"Wearing apparel of every description, manufactured wholly or in part, wholly or in chief value of silk, and nspf",,,,,,,,35,,,,,,32.5
12,1211,"Manufactures wholly or in chief value of silk, nspf",,,,,,,,35,,,,,,32.5
13,1301,"Filaments of rayon or other synthetic textile, grouped, nspf, weighing per length of 450 meters: Under 150 deniers, and valued per pound: Under 80 cents",,,,,Geneva: but not less than 32.5 cents per lb; not further classification on values; Annecy: not less than 22.5 cents per lb; not futher classification on piled or singels,,,27.5,,,25,20,1,
13,,80 cents or more,,,,,"Annecy: not less than 20 cents per lb; not futher classification on piled or singels, also no classification of value",,,27.5,,,25,,,25
13,,"150 deniers or more, and valued per pound: Under 88-8/9 cents",,,,,Geneva: but not less than 22.5 cents per lb; not further classification on values,,,22.5,,,22.5,20,1,
13,,88-8/9 cents or more,,,,,"Annecy: not less than 20 cents per lb; not futher classification on piled or singels, also no classification of value",,,22.5,,,22.5,,,22.5
13,,"Yarns of rayon or other synthetic textile, nspf: Not having over 20 turns twist per inch: Singles, weighing per length of 450 meters: Under 150 deniers, and valued per pound: Under $1.10",,,,,,,,,,,,27.5,1,
13,,$1.10 or more,,,,,,,,,,,,,,25
13,,"150 deniers or more, and valued per pound: Under $1",,,,,,,,,,,,22.5,1,
13,,$1 or more,,,,,,,,,,,,,,22.5
13,,"Plied, weighing per length of 450 meters: Under 150 deniers, and valued per pound: Under $1.19-2/11",,,,,Geneva: but not less than 27.5 cents per lb; not further classification on values,,,30,,,25,32.5,1,
13,,$1.18-2/11 or more,,,,,"Annecy: not less than 20 cents per lb; not futher classification on piled or singels, also no classification of value",,,30,,,25,,,27.5
13,,"150 deniers or more, and valued per pound: Under $1",,,,,"Geneva: not less than 32.5 cents per lb; no further classification on value; Annecy: no less than 20cents per lb, no further classification on value and piled",,,25,,,22.5,25,1,
13,,$1 or more,,,,,"Annecy: no less than 20cents per lb, no further classification on value and piled",,,25,,,22.5,,,25
13,,"Having over 20 turns twist per inch: Singles, weighing per length of 450 meters: Under 150 deniers, and valued per pound:­ Under $1.10",,,,,,,,,,,,50,1,
13,,$1.10 or more,,,,,,,,,,,,22.5,1,25
13,,"150 deniers or more, and valued per pound: Under $1",,,,,,,,,,,,45,1,
13,,$1 or more,,,,,,,,,,,,22.5,1,22.5
13,1301,"Yarns of rayon etc.: Having over 20 turns etc. (con.): Plied, weighing per length of 450 meters: Under 150 deniers, and valued per pound: Under $1.18-2/11",,,,,,,,,,,,55,1,
13,,$1.18-2/11 or more,,,,,,,,,,,,22.5,1,27.5
13,,"150 deniers or more, and valued per pound: Under $1",,,,,,,,,,,,47.5,1,
13,,$1 or more,,,,,,,,,,,,22.5,1,25
13,1302,Rayon or other synthetic textile: Carded or garnetted,,,,,,5,1,12.5,,,,5,1,12.5
13,,"Filaments not over 30 inches long (not including waste), whether known as cut fiber, staple fiber, or by any other name",,,,,,,,20,,,,,,15
13,,Noils,,,,,,,,12.5,,,,,,12.5
13,,"Roving, sliver, and tops",,,,,,5,,15,,,,5,1,15
13,,Waste (except waste wholly or in chief value of cellulose acetate),,,,,,,,,,,,,,5
13,1303,Spun yarn of rayon or other synthetic textile: Singles,,,,,,6.25,1,22.5,,,,6.25,1,22.5
13,,Plied,,,,,,6.25,1,25,,,,6.25,1,25
13,1304,"Yarn of rayon or other synthetic tex­ tile put up for handwork, and sewing thread of rayon or other synthetic textile, valued per pound: Under 90-10/11 cents",,,,,Geneva: but not less than 27.5 cents per lb,,,30,,,,25,1,
13,,90-10/11 cents or more,,,,,,,,,,,,,,27.5
13,1305,"Rayon or other synthetic textile in bands or strips not over 1 inch wide, suitable for the manufacture of textiles, and valued per pound: Under $1",,,,,Geneva: but not less than 27.5 cents per lb,,,25,,,,25,1,
13,,$1 or more,,,,,,,,,,,,,,25
13,1306,"Woven fabrics in the piece, wholly or in chief value of rayon or other synthetic textile, nspf, whether or not Jacquard-figured",,,,,Geneva: if more $4 per pound --- 27.5 cents per pound plus 22.5% ad val,27.5,1,45,,,,25,1,22.5
13,1307,"Pile fabrics (including pile ribbons), whether or not the pile covers the entire surface, wholly or in chief value of rayon or other synthetic textile, and finished or unfinished articles made from such fabrics; all the foregoing, whether the pile is wholly cut, wholly uncut, or partly cut",,,,,,15,1,25,,,,15,1,25
13,1308,"Fabrics with fast edges, not over 12 inches wide, and articles made there­from; braces, cords, cords and tassels, garters, suspenders, tassels, and tubings; all the foregoing wholly or in chief value of rayon or other synthetic textile, or of rayon or other synthetic textile and india rubber, and nspf, whether or not Jacquard­ figured: Ribbons with fast edges, and articles made therefrom",,,,,,27.5,1,25,,,,25,1,25
13,,Other,,,,,,,,,,,,25,1,22.5
13,1309,"Fabric in the piece, knit, wholly or in chief value of rayon or other synthetic textile",,,,,,27.5,1,30,,,,25,1,30
13,,"Wearing apparel and other articles nspf, crocheted or knit, finished or unfinished, wholly or in chief value of rayon or other synthetic textile: Berets, bonnets, caps, hats, and similar articles; hose and half-hose; and underwear",,,,,,27.5,,37,,,,25,1,35
13,,"Gloves and mittens, valued per dozen pairs: Under $1.50",,,,,,27.5,1,65,,,,25,1,65
13,,$1.50 or more,,,,,,,,,,,,25,1,32.5
13,,Other,,,,,,,,,,,,25,1,32.5
13,1310,"Handkerchiefs and woven mufflers, wholly or in chief value of rayon or other synthetic textile, finished or unfinished: Not hemmed",,,,,,27.5,1,60,,,,25,1,30
13,,Hemmed or hemstitched,,,,,,27.5,,65,,,,25,1,32.5
13,1311,"Wearing apparel of every description, manufactured wholly or in part, wholly or in chief value of rayon or other synthetic textile, and nspf",,,,,,27.5,1,35,,,,25,1,32.5
13,1312,"Manufactures of fibers, filaments, threads, or yarns, of rayon or other synthetic textile, and textile products made of bands or strips not over 1 inch wide of rayon or other synthetic textile; all the foregoing wholly on in chief value of rayon or other synthetic textile, nspf",,,,,,27.5,1,35,,,,25,1,35
14,1401,"Uncoated paper commonly or commercially known as book paper, and uncoated printing paper, nspf (not including cover paper)",,,,,,0.2,1,5,,,,0.2,1,5
14,1402,"Cardboard, compress leather or leather board, paper board, pulpboard, and wallboard; all the foregoing, not coated, cut into shapes for boxes or other articles, decorated or ornamented in any manner, embossed, friction calendered or supercalendered, laminated by means of an adhesive substance, lined or vat-lined, plate fin­ished, printed, nor surface stained or dyed, and nspf: Pulpboard in rolls for use in the manufacture of wallboard; straw­board; wallboard; and wet-machine board other than beer mat board",,,,,,,,5,,,5,,,5
14,,Other,,,,,,,,10,,,7.5,,,7.5
14,,"Deadening felt, roofing felt or felt roofing, roofing paper, sheathing felt, and sheathing paper; all the foregoing, whether or not coated or saturated",,,,,,,,5,,,,,,5
14,1403,"Filter masse or filter stock, wholly or in part of vegetable fiber, wood flour, or wood pulp",,,,,,,,15,,,,,,15
14,,"Manufactures of papier-mache, nspf",,,,,,,,,,,12.5,,,12.5
14,,"Manufactures of pulp, nspf",,,,,,,,15,,,,,,15
14,1404,"Bible and india paper, whether in sheets or any other form, weighing per ream: Not over 6 pounds",,,,,,3,1,10,,,,3,1,10
14,,Over 6 but under 10 pounds,,,,,,2.5,1,7.5,,,,2.5,1,7.5
14,,10 or more but under 20-1/2 pounds,,,,,,2,1,5,,,,2,1,5
14,,"Paper commonly or commercially known as crepe paper, including paper creped or partly creped in any manner, valued per pound: Not over 12-1/2 cents",,,,,,0.5,1,3.75,,,,1.5,1,3.75
14,,Over 12-1/2 cents,,,,,,3,1,7.5,,,,3,1,7.5
14,1404,"Papers nspf, colored or uncolored, printed or white, in sheets or any other form, conmonly or commercially known as: Bibulous paper, if valued not over 15 cents per pound, carbon paper, coated or uncoated, condenser paper, copying paper, if valued not over 15 cents per pound, pottery paper, stereotype paper, tissue paper, if valued over 15 cents per pound, or tissue paper for waxing; all the foregoing, weighing per ream: Not over 6 pounds",,,,,,,,,,,,3,1,10
14,,Over 6 but under 10 pounds,,,,,,,,,,,,2.5,1,7.5
14,,"Tissue paper (not including tissue paper for waxing) if valued not over 15 cents per pound, and weighing per ream: Not over 6 pounds",,,,,,,,,,,,1.5,1,5
14,,Over 6 but under 10 pounds,,,,,,,,,,,,1.25,1,3.75
14,,"Papers nspf, similar to (but not including) papers commonly or commercially known as bible or india paper, bibulous paper, coated or uncoated carbon paper, condenser paper, copying paper, pottery paper, stereotype paper, tis­sue paper, or tissue paper for waxing; all the foregoing, colored or uncolored, printed or white, in sheets or any other form, valued per pound: Not over 15 cents, and weighing per ream: Not over 6 pounds",,,,,,,,,,,,1.5,1,5
14,,Over 6 but under 10 pounds,,,,,,,,,,,,1.25,1,5
14,,"Over 15 cents, and weighing per ream: Not over 6 pounds",,,,,,,,,,,,3,1,10
14,,Over 6 but under 10 pounds,,,,,,,,,,,,2.5,1,7.5
14,,"Paper wadding, pulp wadding, and manufactures of either",,,,,,6,1,7.5,,,,6,1,7.5
14,1405,Papers: Cloth-lined or reinforced,,,,,,,,,2.5,1,10,2.5,1,10
14,,"Covered partly or wholly with flock or gelatin: Uncoated wrapping and other uncoated paper, with the surface or surfaces partly or wholly covered or decorated with a character, design, fancy effect, or pattern, which character, design, fancy effect, or pattern was produced otherwise than by lithographic process and otherwise than on a pa­per machine without attachments",,,,,,4.5,1,10,,,,4.5,1,10
14,,Other,,,,,"Geneva:paper with coated surface or surfaces, nspf",2.5,1,7.5,,,,2.5,1,10
14,,Covered partly or wholly with linseed oil cement,,,,,,4.5,1,10,,,,2.5,1,10
14,,"Covered partly or wholly with metal or its solutions, regardless of weight: Uncoated wrapping and other uncoated paper, with the surface or surfaces partly or wholly covered or deco­rated with a character, design, fancy effect, or pattern, which character, design, fancy effect, or pat­tern was produced otherwise than by lithographic process and otherwise than by a paper machine without attachments",,,,,,4.5,1,10,,,,4.5,1,10
14,,Other,,,,,,4.5,1,10,,,,2.5,1,10
14,,"Grease-proof and imitation parchment paper, supercalendered and rendered transparent or partially so, and all other grease-proof and imitation parchment paper nspf; all the foregoing, by whatever name known",,,,,,,,,1.5,1,7.5,1.5,1,7.5
14,,"Gumned, nspf",,,,,,,,,,,,2.5,1,
14,,"Simplex decalcomania, not printed",,,,,,0.25,1,5,,,,1.25,1,5
